Content Type,Kent Market,Dubai Market,File Easy Opportunity,Priority,Implementation Notes
Service Pages,Comprehensive service listings with pricing,Detailed service descriptions with compliance focus,Create service-specific landing pages with local Medway focus,High,Focus on SME-friendly pricing and local business benefits
FAQ Sections,Basic FAQ sections,Comprehensive FAQ with regulatory compliance,Expand current FAQ with Medway-specific questions,High,Add local business scenarios and compliance questions
Case Studies,Industry-specific case studies,Professional case studies with compliance focus,Create anonymized local business success stories,Medium,Focus on Medway businesses and common challenges
Blog Content,Regular blog posts on tax updates,Compliance and regulatory updates,Create Medway business-focused content,Medium,Local business tips, tax updates, compliance guides
Pricing Pages,Transparent pricing models,Competitive pricing with service tiers,Create clear pricing page with Medway focus,High,Simple pricing tiers for local businesses
About Pages,Professional team profiles,Detailed team credentials,Expand team section with local expertise,Medium,Add local business experience and Medway knowledge
Contact Pages,Multiple contact methods,Professional contact forms,Enhance contact page with local business hours,Medium,Add Medway-specific contact information
Testimonials,Client testimonials,Professional testimonials,Add local business testimonials,Medium,Focus on Medway business success stories
Resource Pages,Tax guides and resources,Compliance guides and resources,Create Medway business resource center,Low,Local business guides and compliance resources
Local SEO Content,Kent-focused content,Dubai/UAE-focused content,Create Medway-specific content clusters,High,Focus on Medway towns and local business needs
