Competitor,Market,Strengths,Weaknesses,File Easy Opportunity,Gap Score,Action Required
Perrys Accountants,Kent,"Multi-branch presence, Specialized sectors, ICAEW/ACCA certified","Premium pricing, Complex service offering",Local focus with competitive pricing,85,Create local business testimonials
Cannytax,Kent,"24/7 support, Industry-specific solutions, MTD compliance","Single location, Limited local presence",Multi-location coverage in Medway area,80,Expand service area coverage
Friend & Grant,Kent,"Friendly approach, Tax savings focus, Rochester-based","Limited service range, Basic website",Comprehensive service offering,75,Expand service portfolio
Kreston Reeves,Kent,"Large firm, Wealth management, Audit specialization","Premium pricing, Corporate focus",SME-focused services,70,Target SME market
Bradleys Accountants,Kent,"Xero-certified, SME/startup focus, CIS specialization","Limited local presence, Basic content",Local expertise with modern tools,80,Combine local knowledge with tech
The Accountant,Dubai,"Xero-certified, Cloud-based, FTA-approved, SME focus","Limited local presence, Generic content",Local Dubai expertise,75,Create Dubai-specific content
KBA Accounting,Dubai,"FTA Certified, Multiple awards, Industry expertise","Premium pricing, Corporate focus",Competitive pricing for SMEs,70,Target SME market
A&A Associate,Dubai,"UAE-focused, Comprehensive services","Basic website, Limited differentiation",Professional presentation,65,Improve website quality
ONCOUNT,Dubai,"Licensed firm, Outsourcing focus, UAE-wide coverage","Generic positioning, Limited local focus",Local Dubai expertise,70,Create local Dubai presence
Excellence Accounting,Dubai,"VAT and Corporate Tax expertise","Limited differentiation, Basic content",Specialized tax services,75,Focus on tax specialization
